{"work_id":"raja-rani","target_language":"en","scene_id":"raja-rani-s027","archival_scene_ordinal":27,"source_scene_number":null,"scene_status":"verified","unit_count":1,"units":[{"id":"raja-rani-en-s027-u001","kind":"stage-direction","status":"verified","target_language":"en","scene_id":"raja-rani-s027","archival_scene_ordinal":27,"source":{"source_path":"works/raja-rani/scenes/scene-027.md","canonical_scene_path":"works/raja-rani/scenes/scene-027.md","source_record_id":null,"source_occurrence_id":null,"source_locator":{"kind":"source-parenthetical","ordinal":1,"description":"Raja tells Current how he escaped from Samarasam's house and says he is going to ask forgiveness for it."},"speaker_label":null,"page_provenance":[{"pdf_page":43,"printed_page":42}]},"translation":{"english_text":"(Raja tells Current how he escaped from Samarasam's house and says that he is going to ask forgiveness for it.)","mode":"prose-faithful","notes":[]}}]}