{"work_id":"raja-rani","target_language":"en","scene_id":"raja-rani-s038","archival_scene_ordinal":38,"source_scene_number":null,"scene_status":"verified","unit_count":1,"units":[{"id":"raja-rani-en-s038-u001","kind":"stage-direction","status":"verified","target_language":"en","scene_id":"raja-rani-s038","archival_scene_ordinal":38,"source":{"source_path":"works/raja-rani/scenes/scene-038.md","canonical_scene_path":"works/raja-rani/scenes/scene-038.md","source_record_id":null,"source_occurrence_id":null,"source_locator":{"kind":"opening-stage-direction","ordinal":1,"description":"Rani introduces Samarasam to Gnanakkan as her employer."},"speaker_label":null,"page_provenance":[{"pdf_page":56,"printed_page":55}]},"translation":{"english_text":"(Rani introduces Samarasam to Gnanakkan as her employer.)","mode":"prose-faithful","notes":[]}}]}