{"work_id":"raja-rani","target_language":"en","scene_id":"raja-rani-s030","archival_scene_ordinal":30,"source_scene_number":null,"scene_status":"verified","unit_count":1,"units":[{"id":"raja-rani-en-s030-u001","kind":"stage-direction","status":"verified","target_language":"en","scene_id":"raja-rani-s030","archival_scene_ordinal":30,"source":{"source_path":"works/raja-rani/scenes/scene-030.md","canonical_scene_path":"works/raja-rani/scenes/scene-030.md","source_record_id":null,"source_occurrence_id":null,"source_locator":{"kind":"source-parenthetical","ordinal":1,"description":"Babu incites rowdies to prevent the play from going on."},"speaker_label":null,"page_provenance":[{"pdf_page":46,"printed_page":45}]},"translation":{"english_text":"(Babu incites rowdies to prevent the play from going on.)","mode":"prose-faithful","notes":[]}}]}