{"work_id":"raja-rani","target_language":"en","scene_id":"raja-rani-s048","archival_scene_ordinal":48,"source_scene_number":null,"scene_status":"verified","unit_count":1,"units":[{"id":"raja-rani-en-s048-u001","kind":"stage-direction","status":"verified","target_language":"en","scene_id":"raja-rani-s048","archival_scene_ordinal":48,"source":{"source_path":"works/raja-rani/scenes/scene-048.md","canonical_scene_path":"works/raja-rani/scenes/scene-048.md","source_record_id":null,"source_occurrence_id":null,"source_locator":{"kind":"transition-stage-direction","ordinal":1,"description":"Babu tells Geetha of a plot involving real poison during the Socrates performance, directed against Raja in the Socrates role."},"speaker_label":null,"page_provenance":[{"pdf_page":66,"printed_page":65}]},"translation":{"english_text":"[Babu tells Geetha of a plot involving real poison during the Socrates performance, directed against Raja while he is playing Socrates.]","mode":"prose-faithful","notes":["This is a source-bounded fictional plot summary; no operational detail is added."]}}]}