{"work_id":"raja-rani","target_language":"en","scene_id":"raja-rani-s008","archival_scene_ordinal":8,"source_scene_number":null,"scene_status":"verified","unit_count":1,"units":[{"id":"raja-rani-en-s008-u001","kind":"stage-direction","status":"verified","target_language":"en","scene_id":"raja-rani-s008","archival_scene_ordinal":8,"source":{"source_path":"works/raja-rani/scenes/scene-008.md","canonical_scene_path":"works/raja-rani/scenes/scene-008.md","source_record_id":null,"source_occurrence_id":null,"source_locator":{"kind":"scene-summary-stage-direction","ordinal":1,"description":"The only source-visible content in the verified archival segment."},"speaker_label":null,"page_provenance":[{"pdf_page":21,"printed_page":20}]},"translation":{"english_text":"(In the collection room, Babu attempts to rape Rani.)","mode":"prose-faithful","notes":["The source uses the direct verb `கற்பழிக்க முயல்கிறான்`; the English does not soften or elaborate it."]}}]}
